{
  "schemaVersion": "1.0",
  "operator": "jr-east",
  "lineId": "jr-east:yamanote",
  "reviewMethod": "Exact Japanese station name and JY station code matched against the ordered stop_position members of the OSM Yamanote outer-loop route relation; no fuzzy match was auto-confirmed.",
  "source": {
    "name": "OpenStreetMap Yamanote outer-loop route relation",
    "url": "https://www.openstreetmap.org/relation/1972920",
    "license": "ODbL 1.0",
    "attribution": "OpenStreetMap contributors",
    "retrievedAt": "2026-09-27T17:00:00+09:00",
    "routeRelationIds": [1972920]
  },
  "mappings": [
    {
      "internalStationId": "jr-east:東京",
      "operator": "jr-east",
      "officialNameJa": "東京",
      "officialNameEn": "Tokyo",
      "stationNumber": "JY01",
      "osmElementType": "node",
      "osmElementId": 3589537652,
      "latitude": 35.681244,
      "longitude": 139.7666095,
      "mappingStatus": "confirmed",
      "reviewedAt": "2026-09-27T17:00:00+09:00"
    },
    {
      "internalStationId": "jr-east:神田",
      "operator": "jr-east",
      "officialNameJa": "神田",
      "officialNameEn": "Kanda",
      "stationNumber": "JY02",
      "osmElementType": "node",
      "osmElementId": 1593264885,
      "latitude": 35.6917689,
      "longitude": 139.7710125,
      "mappingStatus": "confirmed",
      "reviewedAt": "2026-09-27T17:00:00+09:00"
    },
    {
      "internalStationId": "jr-east:秋葉原",
      "operator": "jr-east",
      "officialNameJa": "秋葉原",
      "officialNameEn": "Akihabara",
      "stationNumber": "JY03",
      "osmElementType": "node",
      "osmElementId": 3708276971,
      "latitude": 35.6983647,
      "longitude": 139.7730592,
      "mappingStatus": "confirmed",
      "reviewedAt": "2026-09-27T17:00:00+09:00"
    },
    {
      "internalStationId": "jr-east:御徒町",
      "operator": "jr-east",
      "officialNameJa": "御徒町",
      "officialNameEn": "Okachimachi",
      "stationNumber": "JY04",
      "osmElementType": "node",
      "osmElementId": 1593268411,
      "latitude": 35.7069502,
      "longitude": 139.7746504,
      "mappingStatus": "confirmed",
      "reviewedAt": "2026-09-27T17:00:00+09:00"
    },
    {
      "internalStationId": "jr-east:上野",
      "operator": "jr-east",
      "officialNameJa": "上野",
      "officialNameEn": "Ueno",
      "stationNumber": "JY05",
      "osmElementType": "node",
      "osmElementId": 3708279849,
      "latitude": 35.7135763,
      "longitude": 139.7761427,
      "mappingStatus": "confirmed",
      "reviewedAt": "2026-09-27T17:00:00+09:00"
    },
    {
      "internalStationId": "jr-east:鶯谷",
      "operator": "jr-east",
      "officialNameJa": "鶯谷",
      "officialNameEn": "Uguisudani",
      "stationNumber": "JY06",
      "osmElementType": "node",
      "osmElementId": 3708279854,
      "latitude": 35.7217118,
      "longitude": 139.7779296,
      "mappingStatus": "confirmed",
      "reviewedAt": "2026-09-27T17:00:00+09:00"
    },
    {
      "internalStationId": "jr-east:日暮里",
      "operator": "jr-east",
      "officialNameJa": "日暮里",
      "officialNameEn": "Nippori",
      "stationNumber": "JY07",
      "osmElementType": "node",
      "osmElementId": 1591333868,
      "latitude": 35.7279885,
      "longitude": 139.7704317,
      "mappingStatus": "confirmed",
      "reviewedAt": "2026-09-27T17:00:00+09:00"
    },
    {
      "internalStationId": "jr-east:西日暮里",
      "operator": "jr-east",
      "officialNameJa": "西日暮里",
      "officialNameEn": "Nishi-Nippori",
      "stationNumber": "JY08",
      "osmElementType": "node",
      "osmElementId": 3708277002,
      "latitude": 35.7322151,
      "longitude": 139.766696,
      "mappingStatus": "confirmed",
      "reviewedAt": "2026-09-27T17:00:00+09:00"
    },
    {
      "internalStationId": "jr-east:田端",
      "operator": "jr-east",
      "officialNameJa": "田端",
      "officialNameEn": "Tabata",
      "stationNumber": "JY09",
      "osmElementType": "node",
      "osmElementId": 3708277022,
      "latitude": 35.7373845,
      "longitude": 139.7617238,
      "mappingStatus": "confirmed",
      "reviewedAt": "2026-09-27T17:00:00+09:00"
    },
    {
      "internalStationId": "jr-east:駒込",
      "operator": "jr-east",
      "officialNameJa": "駒込",
      "officialNameEn": "Komagome",
      "stationNumber": "JY10",
      "osmElementType": "node",
      "osmElementId": 3708276248,
      "latitude": 35.7366191,
      "longitude": 139.747219,
      "mappingStatus": "confirmed",
      "reviewedAt": "2026-09-27T17:00:00+09:00"
    },
    {
      "internalStationId": "jr-east:巣鴨",
      "operator": "jr-east",
      "officialNameJa": "巣鴨",
      "officialNameEn": "Sugamo",
      "stationNumber": "JY11",
      "osmElementType": "node",
      "osmElementId": 3708277019,
      "latitude": 35.7334579,
      "longitude": 139.7394013,
      "mappingStatus": "confirmed",
      "reviewedAt": "2026-09-27T17:00:00+09:00"
    },
    {
      "internalStationId": "jr-east:大塚",
      "operator": "jr-east",
      "officialNameJa": "大塚",
      "officialNameEn": "Otsuka",
      "stationNumber": "JY12",
      "osmElementType": "node",
      "osmElementId": 1950369552,
      "latitude": 35.7317315,
      "longitude": 139.7286102,
      "mappingStatus": "confirmed",
      "reviewedAt": "2026-09-27T17:00:00+09:00"
    },
    {
      "internalStationId": "jr-east:池袋",
      "operator": "jr-east",
      "officialNameJa": "池袋",
      "officialNameEn": "Ikebukuro",
      "stationNumber": "JY13",
      "osmElementType": "node",
      "osmElementId": 3558156196,
      "latitude": 35.730257,
      "longitude": 139.710949,
      "mappingStatus": "confirmed",
      "reviewedAt": "2026-09-27T17:00:00+09:00"
    },
    {
      "internalStationId": "jr-east:目白",
      "operator": "jr-east",
      "officialNameJa": "目白",
      "officialNameEn": "Mejiro",
      "stationNumber": "JY14",
      "osmElementType": "node",
      "osmElementId": 3708276253,
      "latitude": 35.7212053,
      "longitude": 139.7064126,
      "mappingStatus": "confirmed",
      "reviewedAt": "2026-09-27T17:00:00+09:00"
    },
    {
      "internalStationId": "jr-east:高田馬場",
      "operator": "jr-east",
      "officialNameJa": "高田馬場",
      "officialNameEn": "Takadanobaba",
      "stationNumber": "JY15",
      "osmElementType": "node",
      "osmElementId": 3708279825,
      "latitude": 35.7126962,
      "longitude": 139.7035866,
      "mappingStatus": "confirmed",
      "reviewedAt": "2026-09-27T17:00:00+09:00"
    },
    {
      "internalStationId": "jr-east:新大久保",
      "operator": "jr-east",
      "officialNameJa": "新大久保",
      "officialNameEn": "Shin-Ōkubo",
      "stationNumber": "JY16",
      "osmElementType": "node",
      "osmElementId": 3708277017,
      "latitude": 35.7013028,
      "longitude": 139.7001876,
      "mappingStatus": "confirmed",
      "reviewedAt": "2026-09-27T17:00:00+09:00"
    },
    {
      "internalStationId": "jr-east:新宿",
      "operator": "jr-east",
      "officialNameJa": "新宿",
      "officialNameEn": "Shinjuku",
      "stationNumber": "JY17",
      "osmElementType": "node",
      "osmElementId": 3558156201,
      "latitude": 35.6889594,
      "longitude": 139.7002855,
      "mappingStatus": "confirmed",
      "reviewedAt": "2026-09-27T17:00:00+09:00"
    },
    {
      "internalStationId": "jr-east:代々木",
      "operator": "jr-east",
      "officialNameJa": "代々木",
      "officialNameEn": "Yoyogi",
      "stationNumber": "JY18",
      "osmElementType": "node",
      "osmElementId": 1658981778,
      "latitude": 35.6839356,
      "longitude": 139.7019863,
      "mappingStatus": "confirmed",
      "reviewedAt": "2026-09-27T17:00:00+09:00"
    },
    {
      "internalStationId": "jr-east:原宿",
      "operator": "jr-east",
      "officialNameJa": "原宿",
      "officialNameEn": "Harajuku",
      "stationNumber": "JY19",
      "osmElementType": "node",
      "osmElementId": 1579675415,
      "latitude": 35.6702225,
      "longitude": 139.7023701,
      "mappingStatus": "confirmed",
      "reviewedAt": "2026-09-27T17:00:00+09:00"
    },
    {
      "internalStationId": "jr-east:渋谷",
      "operator": "jr-east",
      "officialNameJa": "渋谷",
      "officialNameEn": "Shibuya",
      "stationNumber": "JY20",
      "osmElementType": "node",
      "osmElementId": 1593485539,
      "latitude": 35.6580215,
      "longitude": 139.7015858,
      "mappingStatus": "confirmed",
      "reviewedAt": "2026-09-27T17:00:00+09:00"
    },
    {
      "internalStationId": "jr-east:恵比寿",
      "operator": "jr-east",
      "officialNameJa": "恵比寿",
      "officialNameEn": "Ebisu",
      "stationNumber": "JY21",
      "osmElementType": "node",
      "osmElementId": 2218777508,
      "latitude": 35.6464034,
      "longitude": 139.7101042,
      "mappingStatus": "confirmed",
      "reviewedAt": "2026-09-27T17:00:00+09:00"
    },
    {
      "internalStationId": "jr-east:目黒",
      "operator": "jr-east",
      "officialNameJa": "目黒",
      "officialNameEn": "Meguro",
      "stationNumber": "JY22",
      "osmElementType": "node",
      "osmElementId": 1593326191,
      "latitude": 35.6340624,
      "longitude": 139.7156689,
      "mappingStatus": "confirmed",
      "reviewedAt": "2026-09-27T17:00:00+09:00"
    },
    {
      "internalStationId": "jr-east:五反田",
      "operator": "jr-east",
      "officialNameJa": "五反田",
      "officialNameEn": "Gotanda",
      "stationNumber": "JY23",
      "osmElementType": "node",
      "osmElementId": 1593325906,
      "latitude": 35.6262242,
      "longitude": 139.7235645,
      "mappingStatus": "confirmed",
      "reviewedAt": "2026-09-27T17:00:00+09:00"
    },
    {
      "internalStationId": "jr-east:大崎",
      "operator": "jr-east",
      "officialNameJa": "大崎",
      "officialNameEn": "Osaki",
      "stationNumber": "JY24",
      "osmElementType": "node",
      "osmElementId": 3708277009,
      "latitude": 35.6194747,
      "longitude": 139.728663,
      "mappingStatus": "confirmed",